{
  "schema_version": "investment-master-method/v0.1-draft",
  "master_id": "warren-buffett",
  "catalogue_entity_id": "warren-buffett",
  "display_name": "Warren Buffett / Berkshire",
  "classification": "core_dossier",
  "source_stream": "fundamental",
  "source_acceptance": "accepted",
  "implementation_ready": false,
  "identity_and_mandate_record": {
    "person": "Warren Edward Buffett",
    "organization": "Berkshire Hathaway Inc.",
    "regulatory_cik": "0001067983",
    "roles": [
      {
        "era": "Historical cases through 2025",
        "role": "Chairman and CEO; principal capital allocator, alongside other authorized investment managers",
        "basis_claim_ids": [
          "WB-F-DEPUTIES2016",
          "WB-F-ROLE-CHANGE"
        ]
      },
      {
        "era": "2026-01-01 onward",
        "role": "Chairman; CEO is Greg Abel",
        "basis_claim_ids": [
          "WB-F-ROLE-CHANGE",
          "WB-F-ROLE-2026"
        ]
      }
    ],
    "mandate": "Permanent-capital operating conglomerate, insurance liabilities and float, public equities and wholly owned businesses. Not a retail portfolio or a redeemable long-only mutual fund.",
    "attribution_boundary": "Buffett’s original statements can support his reasoning. Berkshire consolidated holdings include other decision makers, entities and scopes. Initial Apple deputy identity is not established here as Ted versus Todd."
  },
  "scope": {
    "strong": [
      "Durable comprehensible cash-producing equity economics",
      "Owner-cash valuation and capital allocation"
    ],
    "conditional": [
      "Technology or capital-intensive businesses when economic competence is demonstrated"
    ],
    "not_established": [
      "Universal sector ban",
      "Mechanical low-P/E buy screen",
      "Current personal endorsement"
    ],
    "historical_status": "Direct original method facts only; operationalized scenarios are our design."
  },
  "rules": [
    {
      "rule_id": "WB-R-01",
      "method_fact": "Business cash valuation",
      "method_fact_origin": "Auditor operationalization of cited investor evidence; checklist and scenarios are not quotations or claimed historical procedures.",
      "source_ids": [
        "WB-S-OWNERS1999",
        "WB-S-1986"
      ],
      "claim_ids": [
        "WB-F-VALUE",
        "WB-F-OWNEREARNINGS"
      ],
      "our_design_questions": [
        "Reconcile earnings to cash available after maintenance spending and working capital. Separate expansion investment.",
        "Write bear/base/bull cash paths, competitive assumptions and discount-rate sensitivity; report a range.",
        "Reject precision unsupported by accounting or business knowledge."
      ],
      "required_inputs": [
        "Comparable issuer filings and cash-flow notes",
        "Maintenance/growth reinvestment and working-capital estimates labelled as estimates",
        "Customer/competition/capital-allocation evidence",
        "Exact price, obligations, dilution and security-unit facts"
      ],
      "falsifiers": [
        "Cash generation or competitive durability contradicts the assumed mechanism",
        "Required capital or funding exceeds the modelled capacity",
        "Price cannot be supported under defensible assumptions"
      ],
      "limits": [
        "Applies to: Durable cash businesses with estimable reinvestment",
        "Does not apply to: Mechanical low P/E, EBITDA-only or book-value screens",
        "Not established unless a cited claim explicitly supplies one.",
        "Required-input checklist and falsification tests are independent application design, not claimed investor-native rules or thresholds."
      ],
      "historical_eligibility": {
        "status": "candidate_eligible_pending_review",
        "eligible_source_ids": [
          "WB-S-OWNERS1999",
          "WB-S-1986"
        ],
        "reason": "Original claim/publication proof must pass independently; security/case narrative claims do not enter sanitized method export."
      },
      "original_record": {
        "rule_id": "WB-R-01",
        "name": "Business cash valuation",
        "basis_claim_ids": [
          "WB-F-VALUE",
          "WB-F-OWNEREARNINGS"
        ],
        "origin": "Auditor operationalization of cited investor evidence; checklist and scenarios are not quotations or claimed historical procedures.",
        "operational_steps": [
          "Reconcile earnings to cash available after maintenance spending and working capital. Separate expansion investment.",
          "Write bear/base/bull cash paths, competitive assumptions and discount-rate sensitivity; report a range.",
          "Reject precision unsupported by accounting or business knowledge."
        ],
        "fits": "Durable cash businesses with estimable reinvestment",
        "does_not_fit": "Mechanical low P/E, EBITDA-only or book-value screens",
        "benchmark_2026_start_eligible": true,
        "hard_numeric_threshold": "Not established unless a cited claim explicitly supplies one.",
        "basis_source_ids": [
          "WB-S-OWNERS1999",
          "WB-S-1986"
        ],
        "precutoff_evidence_records": [
          {
            "source_id": "WB-S-OWNERS1999",
            "published_at": "1999-01",
            "known_public_by_2025_12_31": true,
            "access_grade": "A_direct_original_read"
          },
          {
            "source_id": "WB-S-1986",
            "published_at": "1987-02-27",
            "known_public_by_2025_12_31": true,
            "access_grade": "A_direct_original_read"
          }
        ],
        "strict_pre2026_eligible": true,
        "precise_evidence_record_ids": [
          "WB-F-VALUE-E1",
          "WB-F-OWNEREARNINGS-E1"
        ],
        "precise_claim_anchors": [
          {
            "claim_id": "WB-F-VALUE",
            "precise_locator": "Owner manual, Intrinsic Value appendix: opening discounted-cash definition paragraph and subsequent estimate-sensitivity/book-value discussion."
          },
          {
            "claim_id": "WB-F-OWNEREARNINGS",
            "precise_locator": "1986 letter Appendix, paragraph defining owner earnings as (a)+(b)-(c), including following incremental-working-capital sentence and maintenance-estimate caveat."
          }
        ],
        "method_vs_application_boundary": "Source-faithful mechanism below is separate from auditor operational_steps. Contemporary or retrospective case provenance does not become original pre-trade intent."
      },
      "application_scope": {
        "applies_to": "Durable cash businesses with estimable reinvestment",
        "does_not_apply_to": "Mechanical low P/E, EBITDA-only or book-value screens",
        "origin": "auditor_adaptation_not_investor_native_rule"
      }
    },
    {
      "rule_id": "WB-R-02",
      "method_fact": "Competence and durability",
      "method_fact_origin": "Auditor operationalization of cited investor evidence; checklist and scenarios are not quotations or claimed historical procedures.",
      "source_ids": [
        "WB-S-1996",
        "WB-S-CNBC2017-MEETING"
      ],
      "claim_ids": [
        "WB-F-CIRCLE",
        "WB-F-TECHFIT"
      ],
      "our_design_questions": [
        "Explain who pays, why customers stay, and what change destroys earning power.",
        "List the strongest evidence against the franchise and explicit unknowns.",
        "Use no-fit or too-hard when crucial assumptions are ungrounded."
      ],
      "required_inputs": [
        "Comparable issuer filings and cash-flow notes",
        "Maintenance/growth reinvestment and working-capital estimates labelled as estimates",
        "Customer/competition/capital-allocation evidence",
        "Exact price, obligations, dilution and security-unit facts"
      ],
      "falsifiers": [
        "Cash generation or competitive durability contradicts the assumed mechanism",
        "Required capital or funding exceeds the modelled capacity",
        "Price cannot be supported under defensible assumptions"
      ],
      "limits": [
        "Applies to: Business-specific knowledge including selected technology-mediated consumer franchises",
        "Does not apply to: Automatic sector stereotypes or prediction of every technology winner",
        "Not established unless a cited claim explicitly supplies one.",
        "Required-input checklist and falsification tests are independent application design, not claimed investor-native rules or thresholds."
      ],
      "historical_eligibility": {
        "status": "candidate_eligible_pending_review",
        "eligible_source_ids": [
          "WB-S-1996",
          "WB-S-CNBC2017-MEETING"
        ],
        "reason": "Original claim/publication proof must pass independently; security/case narrative claims do not enter sanitized method export."
      },
      "original_record": {
        "rule_id": "WB-R-02",
        "name": "Competence and durability",
        "basis_claim_ids": [
          "WB-F-CIRCLE",
          "WB-F-TECHFIT"
        ],
        "origin": "Auditor operationalization of cited investor evidence; checklist and scenarios are not quotations or claimed historical procedures.",
        "operational_steps": [
          "Explain who pays, why customers stay, and what change destroys earning power.",
          "List the strongest evidence against the franchise and explicit unknowns.",
          "Use no-fit or too-hard when crucial assumptions are ungrounded."
        ],
        "fits": "Business-specific knowledge including selected technology-mediated consumer franchises",
        "does_not_fit": "Automatic sector stereotypes or prediction of every technology winner",
        "benchmark_2026_start_eligible": true,
        "hard_numeric_threshold": "Not established unless a cited claim explicitly supplies one.",
        "basis_source_ids": [
          "WB-S-1996",
          "WB-S-CNBC2017-MEETING"
        ],
        "precutoff_evidence_records": [
          {